{
  "model_id": "wan-3.0",
  "provider": "aliyun",
  "version": "3.0",
  "fetched_at": "2026-09-02",
  "source_url": "https://help.aliyun.com/zh/model-studio/wan3-video-generation-api-reference",
  "ability": {
    "tasks": [
      "generate",
      "edit",
      "extend"
    ],
    "inputs": [
      "reference_video",
      "reference_image",
      "audio"
    ],
    "audio": true,
    "note": "阿里云万相 Wan 3.0（模型名 wan3.0-video，另有高速版 wan3.0-video-prime）。支持文生视频、图生视频（首帧/首尾帧）、参考生视频（参考图/视频/音频混合），以及视频编辑、视频延长；原生 30 秒，带声音（默认 audio=true）。",
    "scenes": [
      "t2v",
      "i2v-first-frame",
      "i2v-first-last-frame",
      "r2v"
    ],
    "capabilities": []
  },
  "input_limits": {
    "max_reference_images": 10,
    "max_reference_videos": 5,
    "max_reference_audios": 5,
    "image": {
      "max_bytes": 20971520,
      "formats": [
        "jpeg",
        "jpg",
        "png",
        "webp",
        "bmp"
      ],
      "min_side_px": 240,
      "max_side_px": 8000,
      "min_ratio": 0.125,
      "max_ratio": 8
    },
    "video": {
      "min_duration_seconds": 1,
      "max_duration_seconds": 15,
      "formats": [
        "mp4",
        "mov"
      ]
    },
    "additional_prompt": {
      "max_chars": 20000
    }
  },
  "rules": {
    "generate": {
      "duration_seconds": {
        "min": 2,
        "max": 30
      },
      "resolution": [
        "480p",
        "720p",
        "1080p"
      ],
      "aspect_ratio": [
        "16:9",
        "4:3",
        "1:1",
        "3:4",
        "9:16",
        "adaptive"
      ],
      "ratio_mode": "client_choice",
      "duration_mode": "client_choice",
      "generate_audio": true,
      "audio": {
        "max_reference_audios": 5,
        "extra_charge": false
      },
      "conditional_rules": [
        {
          "when": {
            "inputs": {
              "reference_videos": {
                "min_count": 1
              }
            }
          },
          "constraints": {
            "max_total_video_duration_seconds": 30
          },
          "note": "When video input is supplied, input video duration plus output duration must be at most 30s."
        }
      ],
      "note": "分辨率默认 1080P；ratio 默认 adaptive；duration 默认 5s，无视频输入 2~30s、有视频输入时输入总时长+输出 ≤30s，-1 为智能时长；输出 30fps；图片格式另支持 jpg/bmp（无透明 PNG）、单边 240~8000px、比例 ≤8:1、≤20MB；参考视频 mp4/mov 单条 1~15s、总 ≤15s、单边 240~4096px、≤100MB；参考音频 wav/mp3 单条 1~15s、总 ≤15s、≤15MB；first_frame/last_frame 各最多 1 张，且不能与 reference_xx/file/link 混用；提示词 ≤20000 字；seed 0~2147483647。",
      "supported_parameters": [
        "aspect_ratio",
        "duration",
        "generate_audio",
        "reference_audio",
        "resolution"
      ]
    },
    "edit": {
      "duration_seconds": {
        "min": 2,
        "max": 30
      },
      "resolution": [
        "480p",
        "720p",
        "1080p"
      ],
      "aspect_ratio": [
        "16:9",
        "4:3",
        "1:1",
        "3:4",
        "9:16",
        "adaptive"
      ],
      "ratio_mode": "client_choice",
      "duration_mode": "client_choice",
      "generate_audio": true,
      "audio": {
        "max_reference_audios": 5,
        "extra_charge": false
      },
      "conditional_rules": [
        {
          "when": {
            "inputs": {
              "reference_videos": {
                "min_count": 1
              }
            }
          },
          "constraints": {
            "max_total_video_duration_seconds": 30
          },
          "note": "When video input is supplied, input video duration plus output duration must be at most 30s."
        }
      ],
      "note": "视频编辑：传入 reference_video 配合 prompt 指令编辑视频内容；duration 默认 5s、可 -1（智能时长），有视频输入时输入总时长+输出 ≤30s；ratio 默认 adaptive，可选 16:9/4:3/1:1/3:4/9:16；分辨率默认 1080P。",
      "supported_parameters": [
        "aspect_ratio",
        "duration",
        "generate_audio",
        "reference_audio",
        "resolution"
      ]
    },
    "extend": {
      "duration_seconds": {
        "min": 2,
        "max": 30
      },
      "resolution": [
        "480p",
        "720p",
        "1080p"
      ],
      "aspect_ratio": [
        "adaptive"
      ],
      "ratio_mode": "client_choice",
      "duration_mode": "client_choice",
      "generate_audio": true,
      "audio": {
        "max_reference_audios": 5,
        "extra_charge": false
      },
      "conditional_rules": [
        {
          "when": {
            "inputs": {
              "reference_videos": {
                "min_count": 1
              }
            }
          },
          "constraints": {
            "max_total_video_duration_seconds": 30
          },
          "note": "When video input is supplied, input video duration plus output duration must be at most 30s."
        }
      ],
      "note": "视频延长：传入 reference_video 配合含延长意图的 prompt 向后延长；ratio 必须设为 adaptive（继承原视频比例）；duration 默认 5s、可 -1，输入总时长+输出 ≤30s；分辨率默认 1080P。",
      "supported_parameters": [
        "aspect_ratio",
        "duration",
        "generate_audio",
        "reference_audio",
        "resolution"
      ]
    }
  },
  "output_limits": {
    "max_duration_seconds": 30,
    "aspect_ratio_mode": "client_choice"
  },
  "pricing": {
    "currency": "CNY",
    "unit": "second",
    "note": "按分辨率与地域每秒计费（百炼列表价）：北京 480P 0.30 元/秒、720P 0.60 元/秒、1080P 1.20 元/秒；新加坡 480P 0.05 美元/秒、720P 0.10 美元/秒、1080P 0.20 美元/秒（活动价曾低至 0.21/0.42/0.84 元/秒）。生成音频不额外收费（开关声音价格相同）。",
    "observed_at": "2026-09-02",
    "source": "https://help.aliyun.com/zh/model-studio/wan3-video-generation-api-reference"
  },
  "errors": {
    "InvalidApiKey": {
      "standard": "access_denied",
      "user_message": "未提供有效 API Key，请检查 Authorization 头"
    },
    "InvalidParameter": {
      "standard": "invalid_parameter",
      "user_message": "参数冲突：reference_xx 与 first_frame/last_frame 不能同时传入"
    },
    "note": "页面仅列少量错误示例（InvalidApiKey、缺少异步头、InvalidParameter），未提供完整错误码表。"
  }
}
