{
  "model_id": "seedance-1-0",
  "provider": "volcengine",
  "version": "1.0",
  "fetched_at": "2026-09-02",
  "source_url": "https://docs.volcengine.com/docs/82379/1520757",
  "ability": {
    "tasks": [
      "generate"
    ],
    "inputs": [
      "reference_image"
    ],
    "audio": false,
    "scenes": [
      "t2v",
      "i2v-first-frame",
      "i2v-first-last-frame"
    ],
    "capabilities": [],
    "note": "官方模型 doubao-seedance-1-0-pro-250528（另 pro fast = doubao-seedance-1-0-pro-fast-251015，速度最高快约 3 倍、价格直降 72%，首尾帧不支持）。lite 是独立拆分的两个模型 doubao-seedance-1.0-lite-t2v/i2v-250428，已于 2026-05-11 下线（官方建议迁移 doubao-seedance-2.0-fast-260128），其参数文档已从官方删除——本条目参数以 pro 为准，lite 相关字段无法核实。无声输出（generate_audio 仅 2.0/2.5/1.5 支持）；无参考视频/音频；无编辑/延长。frames 参数是 1.0 系列独有（可生成小数秒视频，帧数须为 25+4n、范围 [29,289]）。t2v 的 ratio 不支持 adaptive（i2v 可）。service_tier=flex 离线推理支持（价 50%）。"
  },
  "input_limits": {
    "image": {
      "max_bytes": 31457280,
      "formats": [
        "jpeg",
        "png",
        "webp",
        "bmp",
        "tiff",
        "gif"
      ],
      "min_side_px": 300,
      "max_side_px": 6000,
      "min_ratio": 0.4,
      "max_ratio": 2.5
    }
  },
  "rules": {
    "generate": {
      "duration_seconds": {
        "min": 2,
        "max": 12
      },
      "resolution": [
        "480p",
        "720p",
        "1080p"
      ],
      "aspect_ratio": [
        "16:9",
        "4:3",
        "1:1",
        "3:4",
        "9:16",
        "21:9"
      ],
      "ratio_mode": "client_choice",
      "duration_mode": "client_choice",
      "generate_audio": false,
      "note": "时长 [2,12] 整数、默认 1080p（480p/720p/1080p，24fps）；不支持 duration=-1（智能时长只属 1.5/2.x）。t2v ratio 只能六档固定且不支持 adaptive（默认 16:9）；i2v 可 adaptive（默认），指定 ratio 与图不一致时居中裁剪、首尾帧不一致以首帧为主裁尾帧。duration 与 frames 二选一（frames 优先级更高，仅 1.0 pro/pro fast 支持）。camera_fixed 1.0 pro 支持但参考图场景不支持；seed ∈ [-1, 2^31-1]；return_last_frame 可选返回尾帧图。prompt 建议：中文 ≤500 字/英文 ≤1000 词。输出像素与 1.5/2.x 不同（如 1080p/16:9 为 1920×1088）。",
      "supported_parameters": [
        "aspect_ratio",
        "duration",
        "generate_audio",
        "resolution"
      ]
    }
  },
  "output_limits": {
    "max_duration_seconds": 12,
    "aspect_ratio_mode": "client_choice"
  },
  "pricing": {
    "currency": "CNY",
    "note": "官方按 token 计费：价格 = token 单价 × 用量，用量 ≈ 输出视频时长×宽×高×帧率/1024（无输入视频项；视频生成模型输入 token 为 0）。pro 在线 15 元/百万 token、离线 flex 7.5 元；pro fast 在线 4.2 元、离线 2.1 元。lite 无定价行。仅成功生成的视频计费，审核失败不计费。",
    "observed_at": "2026-09-02",
    "source": "https://docs.volcengine.com/docs/82379/1520757"
  },
  "errors": {
    "MissingParameter": {
      "standard": "invalid_parameter",
      "user_message": "缺少必填参数"
    },
    "InvalidParameter": {
      "standard": "invalid_parameter",
      "user_message": "参数不合法，请按文档检查"
    },
    "InvalidImageURL": {
      "standard": "invalid_parameter",
      "user_message": "图片 URL 无效"
    },
    "RequestBodyTooLarge": {
      "standard": "invalid_parameter",
      "user_message": "请求体过大（上限 64MB）"
    },
    "InputTextSensitiveContentDetected": {
      "standard": "content_violation.safety",
      "user_message": "输入文本检出敏感内容"
    },
    "InputImageSensitiveContentDetected": {
      "standard": "content_violation.safety",
      "user_message": "输入图像可能包含敏感信息"
    },
    "InputImageSensitiveContentDetected.PrivacyInformation": {
      "standard": "content_violation.real_person",
      "user_message": "输入图像含真人，请获取授权或更换素材"
    },
    "InputImageSensitiveContentDetected.PolicyViolation": {
      "standard": "content_violation.copyright",
      "user_message": "输入图像涉及版权侵权"
    },
    "OutputVideoSensitiveContentDetected": {
      "standard": "content_violation.safety",
      "user_message": "生成的视频可能包含敏感信息"
    },
    "OutputVideoSensitiveContentDetected.PolicyViolation": {
      "standard": "content_violation.copyright",
      "user_message": "生成视频涉及版权侵权"
    },
    "RateLimitExceeded.EndpointRPMExceeded": {
      "standard": "quota_exceeded",
      "user_message": "触发接口 RPM 限流"
    },
    "QuotaExceeded": {
      "standard": "quota_exceeded",
      "user_message": "超出配额"
    },
    "RequestCanceled": {
      "standard": "interrupted",
      "user_message": "请求被取消（499）"
    },
    "AuthenticationError": {
      "standard": "access_denied",
      "user_message": "鉴权失败"
    },
    "OperationDenied": {
      "standard": "access_denied",
      "user_message": "操作被拒绝"
    },
    "ModelNotOpen": {
      "standard": "access_denied",
      "user_message": "模型未开通"
    },
    "AccountOverdueError": {
      "standard": "settlement_failed",
      "user_message": "账户欠费"
    },
    "OperationDenied.ServiceOverdue": {
      "standard": "settlement_failed",
      "user_message": "服务欠费"
    },
    "InternalServiceError": {
      "standard": "provider_failed",
      "user_message": "服务内部错误，请稍后重试"
    },
    "note": "官方推理错误码通用表（与 1.5/2.x 共用）；无独立 timeout 错误码（异步任务超时以任务状态 expired 呈现）。"
  }
}
