{
  "model_id": "runway-gen-4-turbo",
  "provider": "runway",
  "version": "4-turbo",
  "fetched_at": "2026-09-02",
  "source_url": "https://help.runwayml.com/hc/en-us/articles/37327109429011-Creating-with-Gen-4-Video",
  "ability": {
    "tasks": [
      "generate"
    ],
    "inputs": [
      "reference_image"
    ],
    "scenes": [
      "i2v-first-frame"
    ],
    "capabilities": [],
    "note": "Runway 官方没有把 Gen-4 Turbo 当独立基础模型：它是 Gen-4（图生视频）的高速/低成本档位，参数规格与 Gen-4 相同，仅速度更快、单价更低（Turbo 5 credits/s vs Gen-4 12 credits/s；官方建议先用 Turbo 迭代再切 Gen-4）。只支持图生视频（必须有输入图作为首帧），不支持纯文生；时长 5s/10s、24fps。官方该帮助文已标注为 older generation（现主推 Gen-4.5）。榜单模型名 runway-gen4-turbo 即此档位。"
  },
  "input_limits": {
    "image": {
      "formats": [
        "jpg",
        "jpeg",
        "png",
        "webp"
      ],
      "max_bytes": null,
      "min_side_px": null,
      "max_side_px": null,
      "min_ratio": null,
      "max_ratio": null,
      "note": "help 文档仅给出图片格式，未给大小/边长/比例硬约束；Gen-4 API 文档给出宽高比 0.5~2.358、URL ≤16MB，但 Turbo 为 web 档位不直接适用，故不填。"
    },
    "additional_prompt": {
      "max_chars": 1000
    }
  },
  "rules": {
    "generate": {
      "duration_seconds": {
        "min": 5,
        "max": 10,
        "step": 5
      },
      "aspect_ratio": [
        "16:9",
        "9:16",
        "1:1",
        "4:3",
        "3:4",
        "21:9"
      ],
      "ratio_mode": "client_choice",
      "duration_mode": "client_choice",
      "note": "时长仅 5s 或 10s。输出原生规格 720p 级（不是 4K），六档像素：16:9=1280x720、9:16=720x1280、1:1=960x960、4:3=1104x832、3:4=832x1104、21:9=1584x672。24fps 固定。选的分辨率与输入图比例不同会触发裁剪。prompt ≤1000 字符；不支持 negative prompt（可能产生相反效果）。音频生成未在官方文档提及。时长决定总 credits（Turbo：5s=25、10s=50）。",
      "supported_parameters": [
        "aspect_ratio",
        "duration"
      ]
    }
  },
  "output_limits": {
    "max_duration_seconds": 10,
    "aspect_ratio_mode": "client_choice"
  },
  "pricing": {
    "unit": "second",
    "note": "Runway web credits：Gen-4 Turbo 5 credits/s（5s=25、10s=50 total）；Gen-4（非 Turbo）12 credits/s。无公开 credit→USD 官方换算；API 渠道未上架 Turbo（web 与 API credits 池相互独立）。",
    "observed_at": "2026-09-02",
    "source": "https://help.runwayml.com/hc/en-us/articles/37327109429011-Creating-with-Gen-4-Video"
  },
  "errors": {
    "note": "官方帮助中心无该档位专属错误码；Runway API 通用错误码仅存于需登录的开发者门户，未收录。"
  }
}
