{
  "model_id": "kandinsky-5-0",
  "provider": "kandinsky",
  "version": "5.0",
  "fetched_at": "2026-09-02",
  "source_url": "https://github.com/kandinskylab/kandinsky-5",
  "ability": {
    "tasks": [
      "generate"
    ],
    "inputs": [
      "reference_image"
    ],
    "audio": false,
    "scenes": [
      "t2v",
      "i2v-first-frame"
    ],
    "capabilities": [
      "camera-control"
    ],
    "note": "Sber 官方（kandinskylab/kandinsky-5，即 Kandinsky 5.0）核对：视频生成模型支持文生视频（T2V）与图生视频（I2V，输入图作首帧），时长 5s/10s（T2V）与 5s（I2V）；开源权重；提供镜头控制（Camera control）LoRA；支持英/俄提示词；官方未提及音频生成（视频扩散模型，无声）。原榜单推断 inputs 为空，已据官方补全 i2v。"
  },
  "input_limits": {
    "max_reference_images": 1,
    "image": {
      "_missing": true,
      "note": "官方未给出输入图片格式/大小/像素约束（I2V 示例使用 jpg 输入）。"
    }
  },
  "rules": {
    "generate": {
      "duration_seconds": {
        "min": 5,
        "max": 10
      },
      "resolution": null,
      "aspect_ratio": [
        "3:2",
        "5:3"
      ],
      "ratio_mode": null,
      "duration_mode": "client_choice",
      "generate_audio": false,
      "note": "T2V 时长 5s/10s 两档（由所选 checkpoint 决定，非连续区间）；I2V 仅 5s。官方发布 SD（768×512，约 3:2）与 HD（1280×768，约 5:3）两档，非标准清晰度枚举，宽高比随档位固定；官方未提及音频生成。",
      "supported_parameters": [
        "aspect_ratio",
        "duration",
        "generate_audio",
        "resolution"
      ]
    }
  },
  "output_limits": {
    "max_duration_seconds": 10,
    "aspect_ratio_mode": null
  },
  "errors": {
    "_missing": true,
    "note": "官方仓库为本地推理，未提供错误码表。"
  },
  "pricing": {
    "note": "开源权重（Hugging Face），本地推理；官方 GitHub 仓库未提供 API 计费信息。",
    "observed_at": "2026-09-02",
    "source": "https://github.com/kandinskylab/kandinsky-5"
  }
}
