{
  "model_id": "pixverse-v6",
  "provider": "aishi",
  "version": "6",
  "fetched_at": "2026-09-02",
  "source_url": "https://docs.platform.pixverse.ai/v6-2056814m0",
  "ability": {
    "tasks": [
      "generate",
      "extend"
    ],
    "inputs": [
      "reference_video",
      "reference_image"
    ],
    "audio": true,
    "note": "爱诗科技 PixVerse V6。支持文生视频、图生视频、首尾帧转场、参考生视频(Fusion)、视频延长；quality 360p/540p/720p/1080p，duration 1-15s；支持 inline 音频生成(generate_audio_switch)与多镜头(generate_multi_clip_switch)。视频编辑(Modify/Restyle/Swap)走独立 endpoint，不属于 V6 模型本体。",
    "scenes": [
      "t2v",
      "i2v-first-frame",
      "i2v-first-last-frame",
      "r2v"
    ],
    "capabilities": [
      "multi-shot"
    ]
  },
  "input_limits": {
    "image": {
      "max_bytes": 20971520,
      "formats": [
        "jpeg",
        "png",
        "webp"
      ],
      "max_side_px": 10000
    },
    "video": {
      "max_duration_seconds": 30,
      "formats": [
        "mp4",
        "mov",
        "webm"
      ]
    },
    "additional_prompt": {
      "max_chars": 5000
    }
  },
  "rules": {
    "generate": {
      "duration_seconds": {
        "min": 1,
        "max": 15
      },
      "resolution": [
        "360p",
        "540p",
        "720p",
        "1080p"
      ],
      "aspect_ratio": [
        "16:9",
        "4:3",
        "1:1",
        "3:4",
        "9:16",
        "2:3",
        "3:2",
        "21:9"
      ],
      "ratio_mode": "client_choice",
      "duration_mode": "client_choice",
      "generate_audio": true,
      "audio": {
        "max_reference_audios": null,
        "extra_charge": true
      },
      "note": "文生视频(t2v)/Fusion 支持 aspect_ratio 枚举；图生视频(i2v, img_id 单图)、首尾帧转场(transition, first_frame_img+last_frame_img 双图)、Fusion 用 image_references 多图(未标注上限)，这些子任务不传 aspect_ratio（继承参考图）。音频为 inline 生成(generate_audio_switch 开关)，无参考音频参数，官方文档未提供 max_reference_audios。seed 0-2147483647。视频输入(extend/fusion)限 mp4/mov/webm、≤1920px、≤50MB、≤30s。",
      "supported_parameters": [
        "aspect_ratio",
        "duration",
        "generate_audio",
        "resolution"
      ]
    },
    "extend": {
      "duration_seconds": {
        "min": 1,
        "max": 15
      },
      "resolution": [
        "360p",
        "540p",
        "720p",
        "1080p"
      ],
      "aspect_ratio": null,
      "ratio_mode": "inherit_from_reference_video",
      "duration_mode": "client_choice",
      "generate_audio": true,
      "audio": {
        "max_reference_audios": null,
        "extra_charge": true
      },
      "note": "延长任务官方文档明确不支持 aspect_ratio（参数表标 ❌，自动继承待延长视频）。音频为 inline 生成，无参考音频参数，官方文档未提供 max_reference_audios。输入视频限 mp4/mov/webm、≤1920px、≤50MB、≤30s。",
      "supported_parameters": [
        "aspect_ratio",
        "duration",
        "generate_audio",
        "resolution"
      ]
    }
  },
  "output_limits": {
    "max_duration_seconds": 15,
    "aspect_ratio_mode": "client_choice"
  },
  "pricing": {
    "currency": "USD",
    "unit": "second",
    "tiers": {
      "360p": 5,
      "540p": 7,
      "720p": 9,
      "1080p": 18
    },
    "note": "积分/秒（无音频档）。含音频档 360p:7 / 540p:9 / 720p:12 / 1080p:23；Fusion 输入含 video_references 时翻倍（如 720p 无音频 18、含音频 24）。$1≈5 条 720p/5s/无音频（Starter 包）。",
    "observed_at": "2026-09-02",
    "source": "https://docs.platform.pixverse.ai/v6-2056814m0"
  },
  "errors": {
    "99999": {
      "standard": "provider_failed",
      "user_message": "未知错误"
    },
    "400011": {
      "standard": "invalid_parameter",
      "user_message": "参数为空"
    },
    "400012": {
      "standard": "access_denied",
      "user_message": "账号无效"
    },
    "400013": {
      "standard": "invalid_parameter",
      "user_message": "参数绑定无效：类型或值不正确"
    },
    "400017": {
      "standard": "invalid_parameter",
      "user_message": "参数无效"
    },
    "400018": {
      "standard": "invalid_parameter",
      "user_message": "提示词/负向提示词超长"
    },
    "400019": {
      "standard": "invalid_parameter",
      "user_message": "提示词/负向提示词超长"
    },
    "400032": {
      "standard": "invalid_parameter",
      "user_message": "图片 ID 无效"
    },
    "500008": {
      "standard": "invalid_parameter",
      "user_message": "请求的数据不存在"
    },
    "500020": {
      "standard": "access_denied",
      "user_message": "用户无此操作权限"
    },
    "500030": {
      "standard": "invalid_parameter",
      "user_message": "图片大小超过 20M/10000px"
    },
    "500031": {
      "standard": "provider_failed",
      "user_message": "获取图片信息失败"
    },
    "500032": {
      "standard": "invalid_parameter",
      "user_message": "图片格式无效"
    },
    "500033": {
      "standard": "invalid_parameter",
      "user_message": "图片宽高无效"
    },
    "500041": {
      "standard": "provider_failed",
      "user_message": "图片上传失败"
    },
    "500042": {
      "standard": "invalid_parameter",
      "user_message": "图片路径无效"
    },
    "500044": {
      "standard": "quota_exceeded",
      "user_message": "并发生成数已达上限"
    },
    "500054": {
      "standard": "content_violation.safety",
      "user_message": "图片内容不合规，请更换图片"
    },
    "500060": {
      "standard": "quota_exceeded",
      "user_message": "本月特效激活额度用尽"
    },
    "500063": {
      "standard": "content_violation.safety",
      "user_message": "视频/图片/文本审核不通过，请重新输入"
    },
    "500064": {
      "standard": "invalid_parameter",
      "user_message": "内容已删除"
    },
    "500069": {
      "standard": "provider_failed",
      "user_message": "系统高负载，请稍后重试"
    },
    "500070": {
      "standard": "invalid_parameter",
      "user_message": "当前模板未激活"
    },
    "500071": {
      "standard": "invalid_parameter",
      "user_message": "该特效不支持 720p/1080p"
    },
    "500090": {
      "standard": "quota_exceeded",
      "user_message": "余额不足，请充值积分"
    },
    "500100": {
      "standard": "provider_failed",
      "user_message": "服务端内部错误"
    }
  }
}
